{
  "task_id": "T3",
  "task_title": "Standard Ascent",
  "robot_name": "H1-LabBaseline",
  "morphology_track": "humanoid",
  "build_variant": "canonical",
  "trial_dir": "baselines/real_robot_baseline/T3_standard_ascent",
  "metrics": {
    "success": 0.9,
    "completion_time_s": 13.6,
    "extra_support_contacts": 0,
    "recovery_steps": 1,
    "foot_placement_error_mm": 23,
    "energy_proxy": 0.61
  },
  "scoring_coefficients": {
    "alpha": 0.15,
    "beta": 0.1,
    "gamma": 0.05
  },
  "task_score": 0.8576,
  "notes": [
    "Aggregate score is for summary use only; leaderboard views should preserve raw metrics.",
    "Swing-foot clearance and completion time distinguish conservative from confident ascent behavior."
  ]
}
