{
  "task_id": "T4",
  "task_title": "Standard Descent",
  "robot_name": "AtlasSim-LocoPolicy",
  "morphology_track": "humanoid",
  "build_variant": "canonical",
  "trial_dir": "baselines/sim_baseline/T4_standard_descent",
  "metrics": {
    "success": 0.88,
    "completion_time_s": 13.1,
    "extra_support_contacts": 1,
    "recovery_steps": 1,
    "foot_placement_error_mm": 26,
    "energy_proxy": 0.62
  },
  "scoring_coefficients": {
    "alpha": 0.15,
    "beta": 0.1,
    "gamma": 0.05
  },
  "task_score": 0.8051,
  "notes": [
    "Aggregate score is for summary use only; leaderboard views should preserve raw metrics.",
    "Recovery steps and support contacts expose uncertainty handling on descent."
  ]
}
