{
  "task_id": "T6",
  "task_title": "Discrete Crossing",
  "robot_name": "H1-LabBaseline",
  "morphology_track": "humanoid",
  "build_variant": "canonical",
  "trial_dir": "baselines/real_robot_baseline/T6_discrete_crossing",
  "metrics": {
    "success": 0.84,
    "completion_time_s": 7.0,
    "extra_support_contacts": 1,
    "recovery_steps": 1,
    "foot_placement_error_mm": 24,
    "energy_proxy": 0.56
  },
  "scoring_coefficients": {
    "alpha": 0.15,
    "beta": 0.1,
    "gamma": 0.05
  },
  "task_score": 0.771,
  "notes": [
    "Aggregate score is for summary use only; leaderboard views should preserve raw metrics.",
    "The task should penalize edge contacts even when the robot eventually reaches the landing."
  ]
}
