{
  "task_id": "T1",
  "task_title": "Steady Walking",
  "robot_name": "AtlasSim-LocoPolicy",
  "morphology_track": "humanoid",
  "build_variant": "canonical",
  "trial_dir": "baselines/sim_baseline/T1_steady_walking",
  "metrics": {
    "success": 1.0,
    "completion_time_s": 6.2,
    "extra_support_contacts": 0,
    "recovery_steps": 0,
    "foot_placement_error_mm": 18,
    "energy_proxy": 0.44
  },
  "scoring_coefficients": {
    "alpha": 0.15,
    "beta": 0.1,
    "gamma": 0.05
  },
  "task_score": 0.978,
  "notes": [
    "Aggregate score is for summary use only; leaderboard views should preserve raw metrics.",
    "Primary metric is success. Time and drift penalties separate stable from merely successful gait."
  ]
}
